{
  "contractVersion": "video.world.catalog-execution-workflow.v1",
  "tenantId": "018f47c2-4a3b-7a10-8a11-000000000001",
  "projectId": "018f47c2-4a3b-7a10-8a11-000000000002",
  "executionPlanId": "018f47c2-4a3b-7a10-8a11-000000000007",
  "executionPartitionId": "018f47c2-4a3b-7a10-8a11-000000000008",
  "executionAttemptId": "018f47c2-4a3b-7a10-8a11-000000000009",
  "authorityId": "vw-catalog-execution/018f47c2-4a3b-7a10-8a11-000000000001/018f47c2-4a3b-7a10-8a11-000000000009/c2eb869497aeb3e5cd01e158",
  "terminalState": "SUCCEEDED",
  "authorityResultDigest": "95e4815d95ada0e16fefbf319702ecbdbf6710f7b994191ca64cae8e3ec654d3",
  "partitionReceiptObject": {
    "schemaVersion": "2.0.0",
    "objectRefId": "018f47c2-4a3b-7a10-8a11-000000000018",
    "tenantId": "018f47c2-4a3b-7a10-8a11-000000000001",
    "projectId": "018f47c2-4a3b-7a10-8a11-000000000002",
    "dataPlaneBindingId": "018f47c2-4a3b-7a10-8a11-000000000003",
    "dataPlaneId": "018f47c2-4a3b-7a10-8a11-000000000004",
    "provider": "ALIBABA_OSS",
    "uri": "oss://video-world-fixtures/execution/catalog/partition-receipt.json",
    "objectKey": "execution/catalog/partition-receipt.json",
    "format": "JSON",
    "mediaType": "application/vnd.video-world.partition-receipt.v1+json",
    "checksum": "66a9ae1a14334bbba35f860a52aba18b3fdbc3b633492669cc29ad7e706684c5",
    "sizeBytes": 512,
    "etag": "catalog-receipt-etag",
    "versionToken": "catalog-receipt-version-1",
    "schemaDigest": "6e48ff531602641573b2171600999fcea395612874536ad646f84b99639c4fe9",
    "encryptionContextDigest": "36ec5661379829161af913ac91de2871d391097c92ab21f1ba2c7bfffb5ec774",
    "createdAt": "2026-10-23T00:00:02Z",
    "identityDigest": "28cef6f635a6d8d113f02f34932e14f7fa099c8fa41c447ef24d7ddc9a179788"
  },
  "partitionReceiptSemanticDigest": "5de8047edc1058630cc5b6f22cbf75d971d2e974284680f3782bb0e8c8325e6a",
  "completedAt": "2026-10-23T00:00:03Z",
  "resultDigest": "55c4645a9d553fe0a1d607caabd83446321f9a348fba91dbe69ebd0bff28f347"
}
